{
  "$schema": "https://json-schema.org/draft/2020-12/schema",
  "additionalProperties": false,
  "properties": {
    "artifacts": {
      "items": {
        "additionalProperties": false,
        "properties": {
          "path": {
            "minLength": 1,
            "type": "string"
          },
          "rows": {
            "minimum": 0,
            "type": [
              "integer",
              "null"
            ]
          },
          "schemaVersion": {
            "minLength": 1,
            "type": "string"
          },
          "sha256": {
            "minLength": 1,
            "pattern": "[0-9a-f]{64}",
            "type": "string"
          },
          "sizeBytes": {
            "minimum": 0,
            "type": "integer"
          }
        },
        "required": [
          "path",
          "sha256",
          "sizeBytes",
          "rows",
          "schemaVersion"
        ],
        "type": "object"
      },
      "minItems": 0,
      "type": "array"
    },
    "cricketNationCatalogSha256": {
      "minLength": 1,
      "pattern": "[0-9a-f]{64}",
      "type": "string"
    },
    "eligibilityManifestFileSha256": {
      "minLength": 1,
      "pattern": "[0-9a-f]{64}",
      "type": "string"
    },
    "eligibilityManifestHash": {
      "minLength": 1,
      "pattern": "[0-9a-f]{64}",
      "type": "string"
    },
    "eligibilityVersion": {
      "minLength": 1,
      "type": "string"
    },
    "g2EligibleIdSetSha256": {
      "minLength": 1,
      "pattern": "[0-9a-f]{64}",
      "type": "string"
    },
    "legacyMetadataSha256": {
      "minLength": 1,
      "pattern": "[0-9a-f]{64}",
      "type": "string"
    },
    "manualMetadataSha256": {
      "minLength": 1,
      "pattern": "[0-9a-f]{64}",
      "type": "string"
    },
    "metadataAggregateHash": {
      "minLength": 1,
      "pattern": "[0-9a-f]{64}",
      "type": "string"
    },
    "metadataManifestHash": {
      "minLength": 1,
      "pattern": "[0-9a-f]{64}",
      "type": "string"
    },
    "metadataVersion": {
      "enum": [
        "ipl-country-overseas-metadata/v1"
      ],
      "minLength": 1,
      "type": "string"
    },
    "schemaFiles": {
      "items": {
        "additionalProperties": false,
        "properties": {
          "path": {
            "minLength": 1,
            "type": "string"
          },
          "rows": {
            "minimum": 0,
            "type": [
              "integer",
              "null"
            ]
          },
          "schemaVersion": {
            "minLength": 1,
            "type": "string"
          },
          "sha256": {
            "minLength": 1,
            "pattern": "[0-9a-f]{64}",
            "type": "string"
          },
          "sizeBytes": {
            "minimum": 0,
            "type": "integer"
          }
        },
        "required": [
          "path",
          "sha256",
          "sizeBytes",
          "rows",
          "schemaVersion"
        ],
        "type": "object"
      },
      "minItems": 0,
      "type": "array"
    },
    "schemaVersion": {
      "enum": [
        "ipl-country-overseas-manifest/v1"
      ],
      "minLength": 1,
      "type": "string"
    },
    "stage2RegistryAggregateHash": {
      "minLength": 1,
      "pattern": "[0-9a-f]{64}",
      "type": "string"
    },
    "stage2RegistryVersion": {
      "minLength": 1,
      "type": "string"
    }
  },
  "required": [
    "schemaVersion",
    "metadataVersion",
    "stage2RegistryVersion",
    "stage2RegistryAggregateHash",
    "eligibilityVersion",
    "eligibilityManifestHash",
    "eligibilityManifestFileSha256",
    "g2EligibleIdSetSha256",
    "manualMetadataSha256",
    "cricketNationCatalogSha256",
    "legacyMetadataSha256",
    "artifacts",
    "schemaFiles",
    "metadataAggregateHash",
    "metadataManifestHash"
  ],
  "title": "Country/overseas metadata manifest",
  "type": "object"
}
