{
  "artifacts": [
    {
      "path": "cricket_nations.json",
      "rows": 8,
      "schemaVersion": "ipl-cricket-nation-catalog/v1",
      "sha256": "793928b042188484db46d273f81865e356643df02c3a870776cc8a7f734c047d",
      "sizeBytes": 1281
    },
    {
      "path": "player_metadata.jsonl",
      "rows": 816,
      "schemaVersion": "ipl-country-overseas-player-row/v3",
      "sha256": "bdeab5a1ef521955ace1d37c4422eefad615eebbab131af753cb46c642e8e58a",
      "sizeBytes": 317479
    },
    {
      "path": "player_team_season_metadata.jsonl",
      "rows": 3392,
      "schemaVersion": "ipl-country-overseas-pts-row/v3",
      "sha256": "ddb6846b485314fd4e947247a47fc1bab09265dc995d9a5e9a70e57671bfd616",
      "sizeBytes": 1947456
    },
    {
      "path": "g2_review_queue.json",
      "rows": 717,
      "schemaVersion": "ipl-country-overseas-review-queue/v1",
      "sha256": "4088e9696e4338b01c3781555e4c83f6e2fa6fc1ee258b24a629df0c1c4d3f76",
      "sizeBytes": 482446
    },
    {
      "path": "non_g2_backlog.json",
      "rows": 89,
      "schemaVersion": "ipl-country-overseas-review-queue/v1",
      "sha256": "93641c152870dfa0d4cab713dc83893bded3d8621c5530ce88a5f345e98da78d",
      "sizeBytes": 39744
    },
    {
      "path": "legacy_migration_report.json",
      "rows": 147,
      "schemaVersion": "ipl-country-overseas-legacy-migration/v3",
      "sha256": "8f546f5d17b268da60b3357dbeecd5b5c350a4aec48e9711238fdf48fd6b9c23",
      "sizeBytes": 212294
    }
  ],
  "cricketNationCatalogSha256": "bed19bb4970f12ba36c415a4c3a50804587d7f3b19b169feeea00d78b4450200",
  "eligibilityManifestFileSha256": "6b8cde98ed6c99d99120b558650ce6fbe9523c6f839d84e61d1fabddeeddd50b",
  "eligibilityManifestHash": "b3e6393851e999c23abbc120083b52e8bc444e747d9be7316e0ca73e07be38b6",
  "eligibilityVersion": "ipl-era-draft-eligibility/v1",
  "g2EligibleIdSetSha256": "c0fa9b89561698b0c50a5dacdd4333293c9a7f2f1018ce291f1023d13c6281f3",
  "legacyMetadataSha256": "8612b75cfbd40d99be6754f06fc867cc8e00b54d21874775f13c945e3c4c6405",
  "manualMetadataSha256": "242d59df2638415197cd607ff008a8adcfb7c7094baa7eef02cfc21da2219776",
  "metadataAggregateHash": "07677ce0400f23016b65e9935fe27a44fd8eafb3e44050c1e811799afbd71184",
  "metadataManifestHash": "57080adfeac866444efbe52de73e5e4533c7131871452c92f2f16c071e5c76f4",
  "metadataVersion": "ipl-country-overseas-metadata/v1",
  "schemaFiles": [
    {
      "path": "schemas/cricket_nation_catalog.schema.json",
      "rows": null,
      "schemaVersion": "json-schema/2020-12",
      "sha256": "cddd4821535b0af96cd9e1a6332ca358c53e4ab1bc9d4c8a5c1bf54199be5c08",
      "sizeBytes": 1542
    },
    {
      "path": "schemas/legacy_migration_report.schema.json",
      "rows": null,
      "schemaVersion": "json-schema/2020-12",
      "sha256": "d4cfec8e44df1757bc3977526dfa895b2670d69d57324c265edbc43e84932e8d",
      "sizeBytes": 17316
    },
    {
      "path": "schemas/manual_metadata.schema.json",
      "rows": null,
      "schemaVersion": "json-schema/2020-12",
      "sha256": "16abe9baa9a50f17f287ae554ae5776737d95fbc9e7251af29ef8e8efc5ba113",
      "sizeBytes": 31829
    },
    {
      "path": "schemas/metadata_manifest.schema.json",
      "rows": null,
      "schemaVersion": "json-schema/2020-12",
      "sha256": "58bd7b8158c889f3873909938b6d844c4add39cf55b17f3fefbafa172e0d9820",
      "sizeBytes": 3909
    },
    {
      "path": "schemas/player_default.schema.json",
      "rows": null,
      "schemaVersion": "json-schema/2020-12",
      "sha256": "3f08cc62a1ff80d136f60a2d6fa345e20f62fd7568fd95f309d701ddc535b806",
      "sizeBytes": 11490
    },
    {
      "path": "schemas/player_metadata.schema.json",
      "rows": null,
      "schemaVersion": "json-schema/2020-12",
      "sha256": "05d8f7d4be6d0cbc13e7e4d2a1a29aeaeee33ccf7c87381e014c01ef997d7307",
      "sizeBytes": 10297
    },
    {
      "path": "schemas/player_team_season_metadata.schema.json",
      "rows": null,
      "schemaVersion": "json-schema/2020-12",
      "sha256": "e7bd0c9bc112b94394b99c0f41bad321de26a748fe463ba602c30fd61581cc48",
      "sizeBytes": 10840
    },
    {
      "path": "schemas/review_disposition.schema.json",
      "rows": null,
      "schemaVersion": "json-schema/2020-12",
      "sha256": "cd66cd9e2d902573c43d06269b601b9647332eeb1cff706d703aa1482cfd6584",
      "sizeBytes": 1207
    },
    {
      "path": "schemas/review_queue.schema.json",
      "rows": null,
      "schemaVersion": "json-schema/2020-12",
      "sha256": "072901459fadfda4aa615ac14fb6cbebef22e95c9f6bd6788e811c4afa2b2e12",
      "sizeBytes": 3054
    },
    {
      "path": "schemas/season_override.schema.json",
      "rows": null,
      "schemaVersion": "json-schema/2020-12",
      "sha256": "dad09b5a9d7d89092dd11d1f6928d98e6ea10e2892b30f99c6f451fd8a4c0362",
      "sizeBytes": 10594
    },
    {
      "path": "schemas/source_evidence.schema.json",
      "rows": null,
      "schemaVersion": "json-schema/2020-12",
      "sha256": "245439fbdf136e9c652bca41b0d90b47587fcc1905a599e29ea274ff0c83c9da",
      "sizeBytes": 1834
    },
    {
      "path": "schemas/validation_report.schema.json",
      "rows": null,
      "schemaVersion": "json-schema/2020-12",
      "sha256": "62a17ae1c3348381e14f264c53e3d937e8edd176df6742f821943f9d25b3613c",
      "sizeBytes": 6079
    }
  ],
  "schemaVersion": "ipl-country-overseas-manifest/v1",
  "stage2RegistryAggregateHash": "9b23cafe4c2020b43fec7a3d80a13152270164b216ccd5cea3a1b552428ecac7",
  "stage2RegistryVersion": "ipl-identities-v1"
}
